{
  "$schema": "https://json-schema.org/draft-07/schema",
  "title": "Specky spec.json Schema",
  "description": "Validation schema for Specky spec.json file based on the specification in docs/specky-spec-json.md",
  "type": "object",
  "required": ["name", "version", "description"],
  "additionalProperties": false,
  "properties": {
    "name": {
      "type": "string",
      "pattern": "^(@[a-z0-9-_]+\\/)?[a-z0-9-_]+$",
      "description": "Package name, can include NPM-style scoped packages like @angular/material"
    },
    "version": {
      "type": "string",
      "pattern": "^(0|[1-9]\\d*)\\.(0|[1-9]\\d*)\\.(0|[1-9]\\d*)(?:-((?:0|[1-9]\\d*|\\d*[a-zA-Z-][0-9a-zA-Z-]*)(?:\\.(?:0|[1-9]\\d*|\\d*[a-zA-Z-][0-9a-zA-Z-]*))*))?(?:\\+([0-9a-zA-Z-]+(?:\\.[0-9a-zA-Z-]+)*))?$",
      "description": "Semantic version string"
    },
    "description": {
      "type": "string",
      "minLength": 1,
      "description": "Description of the component"
    },
    "author": {
      "oneOf": [
        {
          "type": "string",
          "minLength": 1
        },
        {
          "type": "object",
          "required": ["name"],
          "properties": {
            "name": {
              "type": "string",
              "minLength": 1
            },
            "email": {
              "type": "string",
              "pattern": "^[a-zA-Z0-9._%+-]+@[a-zA-Z0-9.-]+\\.[a-zA-Z]{2,}$"
            },
            "url": {
              "type": "string",
              "pattern": "^https?:\\/\\/(?:www\\.)?[-a-zA-Z0-9@:%._\\+~#=]{1,256}\\.[a-zA-Z0-9()]{1,6}\\b(?:[-a-zA-Z0-9()@:%_\\+.~#?&\\/=]*)$"
            }
          },
          "additionalProperties": false
        }
      ]
    },
    "contributors": {
      "type": "array",
      "items": {
        "oneOf": [
          {
            "type": "string",
            "minLength": 1
          },
          {
            "type": "object",
            "required": ["name"],
            "properties": {
              "name": {
                "type": "string",
                "minLength": 1
              },
              "email": {
                "type": "string",
                "pattern": "^[a-zA-Z0-9._%+-]+@[a-zA-Z0-9.-]+\\.[a-zA-Z]{2,}$"
              },
              "url": {
                "type": "string",
                "pattern": "^https?:\\/\\/(?:www\\.)?[-a-zA-Z0-9@:%._\\+~#=]{1,256}\\.[a-zA-Z0-9()]{1,6}\\b(?:[-a-zA-Z0-9()@:%_\\+.~#?&\\/=]*)$"
              }
            },
            "additionalProperties": false
          }
        ]
      }
    },
    "license": {
      "type": "string",
      "enum": [
        "MIT",
        "ISC",
        "Apache-2.0",
        "BSD-2-Clause",
        "BSD-3-Clause",
        "GPL-2.0-only",
        "GPL-3.0-only",
        "LGPL-2.1-only",
        "LGPL-3.0-only",
        "MPL-2.0",
        "AGPL-3.0-only",
        "Unlicense",
        "UNLICENSED"
      ]
    },
    "keywords": {
      "type": "array",
      "items": {
        "type": "string",
        "minLength": 1
      }
    },
    "dependencies": {
      "type": "object",
      "patternProperties": {
        "^(@[a-z0-9-_]+\\/)?[a-z0-9-_]+$": {
          "type": "string",
          "minLength": 1
        }
      },
      "additionalProperties": false
    },
    "repository": {
      "oneOf": [
        {
          "type": "string",
          "pattern": "^https?:\\/\\/(?:www\\.)?[-a-zA-Z0-9@:%._\\+~#=]{1,256}\\.[a-zA-Z0-9()]{1,6}\\b(?:[-a-zA-Z0-9()@:%_\\+.~#?&\\/=]*)$"
        },
        {
          "type": "object",
          "required": ["type", "url"],
          "properties": {
            "type": {
              "type": "string",
              "minLength": 1
            },
            "url": {
              "type": "string",
              "pattern": "^https?:\\/\\/(?:www\\.)?[-a-zA-Z0-9@:%._\\+~#=]{1,256}\\.[a-zA-Z0-9()]{1,6}\\b(?:[-a-zA-Z0-9()@:%_\\+.~#?&\\/=]*)$"
            }
          },
          "additionalProperties": false
        }
      ]
    },
    "homepage": {
      "type": "string",
      "pattern": "^https?:\\/\\/(?:www\\.)?[-a-zA-Z0-9@:%._\\+~#=]{1,256}\\.[a-zA-Z0-9()]{1,6}\\b(?:[-a-zA-Z0-9()@:%_\\+.~#?&\\/=]*)$"
    },
    "bugs": {
      "oneOf": [
        {
          "type": "string",
          "pattern": "^https?:\\/\\/(?:www\\.)?[-a-zA-Z0-9@:%._\\+~#=]{1,256}\\.[a-zA-Z0-9()]{1,6}\\b(?:[-a-zA-Z0-9()@:%_\\+.~#?&\\/=]*)$"
        },
        {
          "type": "object",
          "required": ["url"],
          "properties": {
            "url": {
              "type": "string",
              "pattern": "^https?:\\/\\/(?:www\\.)?[-a-zA-Z0-9@:%._\\+~#=]{1,256}\\.[a-zA-Z0-9()]{1,6}\\b(?:[-a-zA-Z0-9()@:%_\\+.~#?&\\/=]*)$"
            },
            "email": {
              "type": "string",
              "pattern": "^[a-zA-Z0-9._%+-]+@[a-zA-Z0-9.-]+\\.[a-zA-Z]{2,}$"
            }
          },
          "additionalProperties": false
        }
      ]
    },
    "files": {
      "type": "array",
      "items": {
        "type": "string",
        "minLength": 1
      }
    },
    "publishConfig": {
      "type": "object",
      "properties": {
        "registry": {
          "type": "string",
          "pattern": "^https?:\\/\\/(?:www\\.)?[-a-zA-Z0-9@:%._\\+~#=]{1,256}\\.[a-zA-Z0-9()]{1,6}\\b(?:[-a-zA-Z0-9()@:%_\\+.~#?&\\/=]*)$"
        },
        "access": {
          "type": "string",
          "enum": ["public", "restricted"]
        },
        "tag": {
          "type": "string",
          "minLength": 1
        }
      },
      "additionalProperties": false
    }
  }
}