{
  "name": "@specky-pm/spm-init",
  "version": "0.1.0",
  "description": "Component for initializing new Specky component specifications",
  "author": "James Barnes",
  "license": "MIT",
  "keywords": [
    "init",
    "initialization",
    "component",
    "specification",
    "cli"
  ],
  "repository": {
    "type": "git",
    "url": "https://github.com/specky-pm/cli.git"
  },
  "homepage": "https://github.com/specky-pm/cli#readme",
  "bugs": {
    "url": "https://github.com/specky-pm/cli/issues"
  },
  "files": [
    "spec.json",
    "datamodel.json",
    "component.md",
    "tests/**/*.feature"
  ]
}